id;name;jhi_uid;jhi_type;espp_request;asoz_request
1;mobile F;77969;Savings Account Dam;Practical Fresh Pants;Metal deposit
2;Producer;83244;red Chips Soap;Home Loan Account;web-readiness
3;Namibia;39986;Gorgeous Frozen Pants;Common;Savings Account syndicate Planner
4;Refined ;6505;Factors;South Dakota envisioneer Music;Nakfa
5;Bahamian;83319;Salad;Digitized invoice;convergence
6;Mayotte;18485;Facilitator;Views e-enable Communications;National Awesome sky blue
7;Tactics;84453;compress South Georgia and the South Sandwich Islands;compelling mission-critical;bifurcated scalable
8;Small;98688;index orange;Jewelery;monitor
9;1080p Ch;65107;Internal;Investment Account archive Fantastic Plastic Chicken;payment
10;withdraw;47221;Frozen bus;hard drive Robust Networked;Poland
